id	user	icon	portrait	English	Japanese	Final Notes	pic	Filenames	Codes
DARKMOONBEGINS_ARCHETYPE	The Archetype			He aquí, ¡La Luna Oscura!			94	076.jpg	I7F69
DARKMOON_GIRLTHOUGHTS	Girl			En mi sueño llegué a un parlamento de árboles sacudido por un rayo y sentí la presencia de algo profundamente sagrado.					
DARKMOON_LOGFELLATHOUGHTS	Logfella			Anoche escuché el sonido de una vibrante música filtrandose a través de los bosques tras mi choza. ¿Qué sería?					
DARKMOON_DOGFELLATHOUGHTS	Dogfella			Guau Guau Guau. En mi estado de sueño sólo vi las sutiles melodiosas brumas de las hadas silvanas.					
AMPHITHEATRE_OUTRO	The Scythian			Reconstruimos la Trifecta Trigónica y ahora somos héroes.			164	081.jpg	48G1Q
RABBITS_3MURDERS	The Scythian			Hemos asesinado inexplicablemente a 3 conejos indefensos.					
RABBITS_7MURDERS	The Scythian			Hemos asesinado inexplicablemente a 7 conejos indefensos. ¿Estamos ante la evidencia de una mente transtornada?					
RABBITS_13MURDERS	The Scythian			Hemos asesinado inexplicablemente a 13 conejos indefensos.					
RABBITS_17MURDERS	The Scythian			Hemos asesinado inexplicablemente a 17 conejos indefensos. Somos imparables.					
RABBITS_23MURDERS	The Scythian			Hemos asesinado inexplicablemente a 23 conejos indefensos.					
RABBITS_37MURDERS	The Scythian			Hemos asesinado inexplicablemente a 37 conejos indefensos. Tenemos curiosidad por saber qué pasará si seguimos con esta serie de asesinatos.					
RABBITS_53MURDERS	The Scythian			Hemos asesinado inexplicablemente a 53 conejos indefensos. Claramente sufrimos de un desorden obsesivo-compulsivo.					
RABBITS_91MURDERS	The Scythian			Hemos asesinado inexplicablemente a 91 conejos indefensos.					
RABBITS_107MURDERS	The Scythian			Hemos asesinado inexplicablemente a 107 conejos indefensos. ¿Tal vez disminuya nuestra compulsión asesina si dejamos de contar?					
ARCHETYPE_CREDITS	The Archetype								
				S:S&S EP es un proyecto colaborativo tipo videojuego realizado en Toronto. Ponte en contacto o manténte informado en swordandsworcery.com					
			Logos/superbrothers	Concepto original por la organización de arte y diseño conocida como Superbrothers Inc. en superbrothers.ca					
				Canciones y algunos sonidos por el amado compositor y estrella de rock conocido como Jim Guthrie en jimguthrie.org					
			Logos/capy	Ingeniería y milagros por el estudio independiente de videojuegos conocido como Capy en capybaragames.com					
			Logos/eightfour	Traducción al japonés, marketing, relaciones públicas y cariño proporcionados por 8-4, Ltd. Todo el equipo en 8-4.jp										
				* * * EL EQUIPO S:S&S EP * * *					
				Concepto, arte, diseño, dirección y guión por representantes de Superbrothers Inc. (@the1console)					
				Diseño, líder de proyecto, incansable apoyo y más por Kris Piotrowski (@krispiotrowski), director creativo en Capy					
				Sistemas, arquitectura técnica, UI, motor y más por Jon Maur (@buckets187), programador jefe de S:S&S EP en Capy					
				Programación, combate y trabajo milagroso por Frankie Leung (@mpfTempVar), programador jefe de gameplay de S:S&S EP en Capy					
				Inspiración, canciones, sonidos, alma y mucho más cortesía de Jim Guthrie (@jampants), compositor, héroe folk y estrella de rock					
				* * * ADEMÁS * * *					
				"Voz de Don Tronco por Robert Ashley (@robertashley), creador del programa de radio ""A Life Well Wasted"" en www.alifewellwasted.com"					
				Voz de la Escita por la fotógrafa Robyn Cumming en robyncumming.com					
				Voz del Arquetipo por el artista y cineasta Clive Holden (@cliveholden) en cliveholden.com					
				Sonidos cósmicos de la Gruta Lunar por Scientific American (@scntfc) en scntfc.com					
				* * * EQUIPO CAPY * * *					
				Productor ejecutivo, héroe del pueblo, liderazgo y estratificación por Nathan Vella (@Capy_Nathan), presidente en Capy					
				"Productor de PC, asistencia técnica de audio, integración fMOD y muchos sonidos encantadores por Sean ""Uber"" Lohrisch, co-fundador de Capy."					
				"Asistencia administrativa y comercial por Matt ""Juggalord"" Repetski, co-fundador en Capy."					
				"Control de calidad y heroico mega-tester por Christian ""Sea Dawg"" Meyer (@fiddler6) en Capy"					
				Agradecimientos a Xavier Xaden Xen, Joseph Theodore Blocco, Hank Hudson					
				* * * EQUIPO SUPERBROTHERS * * *					
				Enlace, comunicaciones, CC, inspiración, paciencia infinita y apoyo moral interminable cortesía por Jori Baldwin (@aurorajorealis)					
				Asistencia de negocios, apoyo financiero y apoyo moral inquebrantable por Mack C. Adams (@mackaraja)					
				Muchos agradecimientos a Sheila Precious, David Adams, Sarah Adams y Cimarron Corpe por mantener el barco a flote ante mares tormentosos.					
				Muchas gracias a Jim Guthrie por embarcarse en esta aventura loca hacia lo desconocido.					
				Con sonidos adicionales de un millón de dólares cortesía de Timothy Muirhead.					
				* * * EQUIPO 8-4 * * *					
				Traducción al japonés por el maestro de las palabras RYUTA YAZAWA (@lye_)					
				Edición japonesa, consejo crucial y apoyo sin fin por MASAHIRO YUKI (@You_to_the_ki) de Grasshopper Manufacture en www.ghm.jp					
				Diseño del increíble logotipo japonés cortesía de POLYGRAPH (@polygraph_suwa) en www.polygraph.jp					
				Magia del sitio web japonés por Jonathan Lumb (@jonnyram) en www.jonnyram.com					
				Y finalmente, agradecimientos por al apoyo y amistad de @suda_51, Tomoaki Takahashi, @eightbear					
				Y los artistas de remezcla  @baiyon, @akirayamaoka, Michiru Yamane, @macotom3 y Decasségui Hip					
				* * * THE DOMINION OF CANADA * * *					
			Logos/omdc	Este proyecto fue posible gracias al apoyo financiero de la Ontario Media Development Corporation (OMDC).					
				* * * LOS QUEREMOS MUCHO MUCHO * * *					
				A Brandon Boyer (@brandonnn), Mathew Kumar (@mathewkumar) y Jason DeGroot (@jason6955) por alinear las estrellas.					
				"Mucho amor a las increíbles comunidades de videojuegos de Toronto y a la gente encantadora de ""The Hand Eye Society"", TOJam y Gamercamp."					
				A la familia y amigos: los queremos y realmente esperamos volver a verlos. ¿Cómo han estado desde la última vez que hablamos?					
				A todos los que han apoyado y animado este proyecto: ¡Muchas gracias por su paciencia, curiosidad y fe!					
				* * * PROCESO * * *					
				Pixel artwork creado por Cosmigo enteramente en Promotion, con otros elementos visuales creados en Illustrator y Photoshop de Adobe.					
				Sonidos y canciones creadas usando MTV Music Generator de Codemasters para PSOne y/o Garageband y Logic Studio de Apple.					
			Logos/FMOD	Los sonidos y las canciones se integraron en el proyecto utilizando FMOD de Firelight Technologies.					
				El código fue programado utilizando C++ y Lua script con tolua++. Los mapas y elementos del mundo fueron creados con herramientas propiedad de Capy.					
				Cálculo de ciclos lunares y algoritmos astronómicos cortesía de voidware.com/moon_phase.htm					
				Las APIs utilizadas en la creación de S:S&S EP incluyen twitcurl, tinyxml, libpng/zlib, SDL, cmake, y minizip					
				"Un build absurdamente temprano fue presentado en el ""Independent Games Festival"" el 1 de Noviembre de 2009."					
				S:S&S EP fue anunciado el 1 de Diciembre de 2009.					
				"A principios de 2010 se anunció que el proyecto había ganado el premio IGF Mobile ""Achievement in Art""."					
				"La primera demostración pública en directo de S:S&S EP ocurrió en un evento social de la ""Hand Eye Society"" de Toronto el 14 de febrero de 2010."					
				La primera versión jugable de S:S&S EP fue presentada a los asistentes y amigos en la GDC 2010 de San Francisco del 9 al 13 de marzo de 2010.					
				El primer gameplay no editado de la GDC apareció simultáneamente en internet.					
				"""Less Talk, More Rock: The Native Language of Videogames"" fue publicado online en Boing Boing en Marzo de 2010 y puedes buscarlo en Google."					
				"El proyecto ""se oscureció"" durante unos meses, mientras nosotros, ya sabes, hacíamos el videojuego. Clic clic clic clic."					
				Llevó un poco más de tiempo del esperado finalizarlo.					
				"""The Intoxication of Mythology"" fue presentado por Superbrothers el 22 de Septiembre de 2010 en el Fantastic Arcade de Austin."					
				"""Aiming for Audiovisual Alchemy"" fue presentado por Jim Guthrie, Kris Piotrowski y Superbrothers en la Gamercamp de Toronto."					
				"Un nuevo vídeo titulado ""Audience Calibration Procedure"" fue posteado el jueves 24 de febrero de 2011 para empezar a poner en marcha las cosas."					
				S:S&S EP estuvo finalmente disponible para iPad alrededor del equinoccio de primavera de 2011, poco antes del fin del mundo.					
				"Pusimos ""MIDSUMMER ROCKSHOWCASE"" en la TIFF Lightbox de Toronto con material S&S de Jim Guthrie. ¡Fue impresionante!"					
				S:S&S EP se eventualmente se lanzó para iPhone y iPod Touch, y hubo mucho regocijo.					
				En los meses posteriores del lanzamiento algunos de nosotros nos casamos, algunos de nosotros nos separamos y todos nos movimos.					
				"Se le pidió a Jim Guthrie que creara la banda sonora del documental ""Indie Game: The Movie"" (@indiegamemovie)."					
				Capy está concentrada actualmente en crear un puñado de videojuegos entre los que se encuentra el impresionante SUPER T.I.M.E. FORCE.					
				El personal de Superbrothers Inc se está tomando un tiempo para soñar nuevos sueños.					
				S:S&S EP fue uno de los videojuegos Top 10 de 2011 para la revista Time Magazine junto a juegos AAA como Dark Souls y Skyrim, ¡Vaya!					
				"La música de Jim Guthrie fue reconocida como ""La mejor música de videojuego de 2011"" por Kirk Hamilton (@kirkhamilton) en Kotaku."					
				"El hashtag sworcery de S:S&S EP fue ""uno de los mayores eventos de internet de 2011"" según Co.Design & Syzygy."					
				S:S&S EP ganó un Game Developer's Choice Award en la GDC de 2012, superando a títulos AAA... lo cual fue increíble.					
				"Jim Guthrie sacó un nuevo disco llamado ""The Children of the Clone"" con temas de S:S&S EP."					
				Después de eso, la historia se vuelve un poco confusa, así que sintoniza en swordandsworcery.com para más información.					
				Ha sido un viaje positivo y loco, esperamos que sigas cavando.					
				* * * QUÉ ES S:S&S EP? * * *					
				S:S&S EP se concibe como un valiente experimento en el cine de entrada y salida, sea lo que sea que eso signifique.					
				S:S&S EP es un nuevo enfoque para el videojuego de aventuras de la vieja escuela con un énfasis en el estilo audiovisual.					
				S:S&S EP se inspira en el trabajo de creadores de videojuegos pioneros como Shigeru Miyamoto, Jordan Mechner, Eric Chahi y Fumito Ueda.					
				S:S&S EP es un febril sueño Famicom.			38	082.jpg	28B24
				S:S&S EP ha sido construido teniendo en cuenta la mitopoética psicocosmológica de las historias de espadas y brujería de Robert E. Howard.					
				S:S&S EP es un enlace al pasado.			167	083.jpg	18E3V
				S:S&S EP es un primer esfuerzo, así que sí, es un poco experimental.					
				"El concepto estético de S:S&S EP es ""la aventura de videojuego arquetípica""."					
				"S:S&S EP hace referencias indirectas a Carl G. Jung y su fascinante ""Libro Rojo"" en muchos lugares."					
				S:S&S EP es una pequeña cosa que creo que todo el mundo debería jugar en su dispositivo táctil o PC.					
				S:S&S EP es un haiku de videojuego crudo sobre la vida, el amor y la muerte.					
				S:S&S EP trata sobre mitos y sueños.					
				S:S&S EP ha sido creado teniendo en cuenta a un amplio y culto público.					
				"S:S&S EP iba a llamarse en un primer momento ""Poopsock"". Es en serio."					
				* * * HA TERMINADO * * *					
				Entonces, ¿qué sucede después? ¿Y de qué va esa transmisión tan extraña? ¿Qué depara el futuro?					
				¡Si quieres ordenar impresiones, ropa, discos, videojuegos o lo que sea, búscanos en Internet!					
				¡Si disfrutas con el estilo de entretenimiento audiovisual ofrecido por S:S&S EP entonces, por favor, corre la voz!					
				Ahora somos amigos cósmicos para siempre, ¿de acuerdo?			87	084.jpg	L8A48
				Traducción al español por @cesardeg ;)					