id	user	icon	portrait	English	Japanese	Final Notes	pic	Filenames	Codes
				"""Veo que la canción del Trigón ha terminado por ahora. Me pregunto cuándo volveré a escucharla."""					
LOGFELLA_LOSTKEY	The Scythian			El afligido leñador conocido como Don Tronco estaba totalmente fuera de sí por algo.					
			AdventureUI/keyItem	Al parecer Don Tronco había perdido la llave de la puerta de la muralla de piedra que bloqueaba el camino antiguo a Mingi Taw.					
				"Nosotros estábamos en plan de ""otra misión de búsqueda y rescate o... ¿Me equivoco?"""					
				Don Tronco nos dijo haber estado sentado aquí mismo cuando cayó en un sueño profundo.					
			AdventureUI/keyItem	Don Tronco nos dijo que creía haber perdido su llave en el reino crepuscular de los sueños.					
				Ya habíamos oído hablar de los extraños sueños de los montañeses del Cáucaso, de modo que tenía sentido para nosotros.					
				Don Tronco nos invitó a calentar nuestras botas junto al fuego y soñar junto a él.			63	029.jpg	U2C92
ARCHETYPE_LOSTKEYTHOUGHTS	The Archetype			Pensamos en la vigilia y en la psicosmología mitopoética de los sueños como estados separados, sin embargo interoperan de maneras curiosas.					
				El umbral de liminalidad es un espacio entre la vigilia y los sueños donde el pensamiento dirigido es imposible.			56	030.jpg	13A0A
				Busca un hogar cálido y permite que el sueño te arrope para descubrir el umbral de la liminalidad.					
ARCHETYPE_LOSTKEYCLUE	The Archetype		AdventureUI/keyItem	¿Qué tal si vas a sentarte junto al fuego en la choza y cruzas el umbral liminal para encontrar la llave perdida de Don Tronco?			55	031.jpg	23C1X
GIRL_LOSTKEYTHOUGHTS	Girl	AdventureUI/tweetIconGourd		Vaya, Don Tronco está fuera de sí por algo... Me pregunto qué pasará. He preferido salir afuera y dejarlo solo un momento.					
				He visto a la Escita cantar la Canción de Espadamancia y enviar tres hadas silvanas hacia el cielo. Me pregunto si ayudarán a disipar la tormenta.					
LOGFELLA_MORELOSTKEYTHOUGHTS	Logfella			Espero que la Escita pueda encontrar mi llave... la perdí en la orilla arenosa de un lago plácido.			62	032.jpg	U3A20
LOGFELLA_LOSTKEYTHOUGHTS	Logfella			Oh vaya, me gustaría que no estuviera lloviendo afuera... Me gustaría que mis botas no estuvieran tan mojadas... Me gustaría volver a cortar leña.					
				¡Rayos!, ¿¡Dónde está mi llave!? Estoy tan molesto y avergonzado, ¡ahora estoy completamente alterado!					
LOGFELLA_FOUNDKEY	The Scythian		AdventureUI/keyItem	El leñador estaba súper aliviado de que hubiéramos logrado recuperar su llave perdida del reino crepuscular de los sueños.					
				El leñador conocido como Don Tronco se preguntó cómo es que éramos tan inteligentes y nos preguntó sobre nuestro funesto cometido.					
				Le contamos al leñador cómo habíamos llegado a la mayoría de edad en las estepas junto a nuestros intrépidos hermanos y hermanas escitas.					
				Le contamos a Don Tronco por qué deambulabamos por aquí, en esta montaña desierta, y cómo nos guiaba el dedo de un Dios omnisciente.					
			adventureUI/megatomeItem	Le contamos a Don Tronco lo que sospechábamos sobre las marcas esotéricas dentro de El Megatomo y lo que podían significar.					
			gourd/gourd	Teníamos la corazonada de que necesitábamos despertar a unas cuantas hadas silvanas más para disipar la tormenta.			104	033.jpg	W3D3G
			triangle/Triangle	En un susurro silencioso hablamos de nuestra intención de localizar y domar una manifestación de geometría cósmica conocida como el Trigón Dorado.					
				Estaba muy claro que el leñador conocido como Don Tronco había dejado de prestar atención.					
			AdventureUI/keyItem	Pensamos que podríamos simplemente llevarnos la llave e ir a dar un paseo por el camino antiguo más allá de la muralla de piedra.					
LOGFELLA_FOUNDKEYWAKEUP	The Scythian		AdventureUI/keyItem	Le preguntamos al leñador si sería aceptable que tomáramos su llave y nos dijo que estaba de acuerdo.					
GIRL_FOUNDKEY	The Scythian			Nos encontramos con Samae empapada parada bajo la lluvia en un camino lateral.					
			gourd/gourd	Ella había oído las sutiles melodiosas brumas de las hadas silvanas más allá de la muralla de piedra en el camino antiguo a Mingi Taw.					
			gourd/gourd	Ella habló de troncos de árboles altísimos a ambos lados de un poderoso río.					
			gourd/gourd	Ella habló de unos arcoíris débiles en el borde del Precipicio Peligroso.					
			adventureUI/megatomeItem	...Y luego se puso temerosa y nos dijo que consultáramos El Megatomo si nos sentíamos perdidos o confundidos.					
LOGFELLA_FOUNDKEYTHOUGHTS	Logfella			Estoy de acuerdo con que la Escita tome la llave si eso significa disipar la tormenta.					
				Debo haber asentido en algún momento durante la historia súper épica de la Escita. Tengo una tolerancia muy baja para el folclore.					
				Le pregunté a la Escita sobre su funesto cometido... empezó a hablar de las estepas y del dedo de Dios.					
GIRL_FOUNDKEYTHOUGHTS	Girl			Una o dos hadas silvanas más enviadas hacia el cielo disiparán la incesante tormenta... ¡Y entonces será la temporada de milagros! #miracles			129	034.jpg	33A44
GIRL_SUPERMOTHERTREE	Girl			En mi paseos oníricos hay una emocionante quietud cuando la luna está más brillante... y cuando la luna está más oscura, los bosques son salvajes.					
				En el sueño siempre son los mismos lugares y espacios, excepto cuando varían según el temperamento de la luna.					
				Todas las noches desde que la tormenta se disipó he tenido el mismo sueño en el que estoy deambulando por el bosque en la hora antes del amanecer.					
ARCHETYPE_TREEHINT	The Archetype			Recuerda que la ingestión de hongos del bosque puede ofrecer una visión oblicua de los fenómenos criptozoológicos y esas cosas.					
				Busca las melodiosas brumas de las hadas silvanas e investiga sus alrededores.					
				Una vez que hayas comenzado la Canción de Espadamancia puedes tocar el aura y deslizar para mirar alrededor.					
ARCHETYPE_MUSHROOMHINT	The Archetype			Incluso se ha afirmado que los hongos adivinatorios pueden haber jugado un papel significativo en el desarrollo de la psique humana.					
				La evidencia arqueológica indica que el uso chamánico de hongos para la comunión religiosa, adivinación y curación es bastante antigua.					
				Fisiológicamente puedes notar sentimientos de bienestar y percepciones aumentadas, una disipación del estrés y una pérdida del apetito.					
				Los hongos del bosque pueden ofrecer una cierta visión oblicua sobre el paradero de una hada silvana y sus peculiares activadores.			60	035.jpg	53A5Y
ARCHETYPE_TRIGONGROVE	The Archetype			¿Puedes sentirlo? ¿Estás empezando a entender? ¿Tienen un nuevo significado las marcas y formas esotéricas dentro de El Megatomo?					
				Este haz es un puente que une el mundo de los vivos y los muertos, puede que encuentres a uno o dos fantasmas con los que hablar en tus viajes.					
				Acabo de recibir la notificación de que has activado el primer haz celeste en el Bosque Trigónico.					
GIRL_CABINSHEEP	The Scythian			Le preguntamos a Samae sobre las ovejas insignificantes que holgazaneaban por la choza y nos dijo que hace un momento se habían asustado.					
			gourd/gourd	Le dijimos a Samae que habíamos enviado cinco hadas silvanas hacia el cielo y nos dijo que tal vez la temporada de milagros estaba cerca.					
				Pensamos que tal vez deberíamos ir a investigar al prado donde solían holgazanear las ovejas.					
LOGFELLA_CABINSHEEP	The Scythian			Don Tronco tenía la sensación de que había llegado la temporada de milagros y se preguntó si, tal vez, estaba a punto de suceder algo impresionante.			79	036.jpg	V3G62
GIRL_CABINSHEEPTHOUGHTS	Girl			Pero qué... ¡La lluvia ha cesado! ¿Está comenzando a disiparse la tormenta? Eso espero.					
				Todo esto de la tormenta me ha estado afectando el ánimo. Ha sido todo tan sombrío.					
LOGFELLA_CABINSHEEPTHOUGHTS	Logfella			Hmm.... Se me puso la piel de gallina... Sin duda algo está pasando... ¿Está comenzando a disiparse la tormenta?					
				Cada vez que necesito recobrar fuerzas, me siento junto al fuego para calentarme las botas.					
DOGFELLA_CABINSHEEPTHOUGHTS	Dogfella			Guau Guau Guau Guau Guau Guau Guau Guau. #stillbarking #miracles			84	037.jpg	V3C7I
ARCHETYPE_MEADOWHINT	The Archetype			Una vez que el sol esté alineado, se te concederán las habilidades milagrosas de plegado del gran mago Al Jaffee					
				¿Sientes esa sensación peculiar? ¡Es la temporada de milagros! Canta la Canción de Espadamancia y mira hacia los amenazadores pájaros enojados que se ciernen en el cielo.			76	038.jpg	A3G84
ARCHETYPE_MEADOWHINTTWO	The Archetype			Mira al cielo en busca de una visión oblicua sobre el funcionamiento de este milagro del prado y admira al Trigón Dorado.					
ARCHETYPE_SIDE_B	The Archetype	AdventureUI/tweetIconInfo		Hmm... interesante la forma con que has manejado el encuentro con el caníbal cabeza de oso.			120	039.jpg	O3G9D
				No, no te preocupes, está bien, es solo interesante. Nunca había visto a nadie hacer lo que hiciste. Es excepcional, pero no te alarmes.					
				Bueno, sigamos. Aún te quedan muchas cosas por disfrutar en tu experiencia con S:S&S EP, particularmente en la Cara B.					
ARCHETYPE_GOLDTRIGONHINTONE	The Archetype			Para domar al Trigón Dorado debes aprender a sobrevivir a los tres movimientos de su extraña canción usando una mezcla de ataque y defensa.					
				Es absolutamente fundamental que mantengas presionado el botón de escudo siempre que puedas para recobrar tu fuerza perdida.					
				Veo que ya has invocado e intentado domar al Trigón Dorado. Tengo algunas cosas que comentarte que creo te serán de útilidad.					
ARCHETYPE_GOLDTRIGONHINTTWO	The Archetype			Repele los ataques de proyectiles psiónicos del Trigón con tu espada y espera al momento justo para esquivar los ataques cargados.			83	040.jpg	3.4E+02
				La lógica inescrutable e insondable del Trigón Dorado ha reclamado las almas de todos aquellos que te precedieron... ellos carecían de tenacidad y coraje.					
ARCHETYPE_GOLDTRIGONHINTTHREE	The Archetype			El Trigón Dorado debe ser domado, no hay otra opción.					
				En el tercer patrón debes repeler los pequeños proyectiles triangulares con tu espada y esquivar los ataques cargados.					
				En el segundo patrón debes esperar al ataque cargado y presionar el botón de escudo en el momento adecuado para esquivarlo.					
				En el primer patrón debes utilizar tu espada para devolver la bola de energía.					
ARCHETYPE_BRIGHTTRIGONHINTONE	The Archetype			Es posible que hayas notado que el Trigón Luna Brillante reparte muerte desde arriba... así que espera al momento justo y usa tu escudo para esquivar.			144	041.jpg	8.4E+12
ARCHETYPE_BRIGHTTRIGONHINTTWO	The Archetype			El patrón final del Trigón Luna Brillante requerirá que uses tu espada contra los proyectiles y esquives los ataques cargados.					
ARCHETYPE_DARKTRIGONHINTONE	The Archetype			Es posible que ya te hayas encontrado con el ataque de arcoíris del Trigón Luna Oscura. Rebana ese arcoíris tan rápido como puedas.					
ARCHETYPE_DARKTRIGONHINTTWO	The Archetype			El patrón final del Trigón Luna Oscura implica sutiles proyectiles triangulares. Aplástalos y sobrevivirás.					
ARCHETYPE_MEGATOMEOUTRO	The Archetype	AdventureUI/tweetIconBabelBook		Así que has despertado al espectro inmortal que aletargaba en la oscuridad debajo de Mingi Taw... ¡Uff!					
				En consecuencia, se vislumbra una siniestra tormenta y la gente encantadora que vive en la choza de piedra se siente desolada.					
			adventureUI/megatomeItem	El resultado es que tienes el pesado libro conocido como El Megatomo. En nuestra próxima sesión hablaremos de su extraño propósito.					
				Nuestra investigación ha demostrado que la exposición prolongada a la psicosmología mitopoética de S:S&S EP puede tener efectos adversos.					
				Así que ahora que has completado la Sesión I, ¿qué te parece si nos tomamos un pequeño descanso? Estaré justo aquí cuando quieras comenzar la sesión II.					
ARCHETYPE_GOLDMASTERINTRO	The Archetype	AdventureUI/tweetIconBabelBook							
				Me alegra volver a verte por aquí. ¿Todo listo para comenzar con la Sesión II de S:S&S EP?					
			adventureUI/megatomeItem	Muy bien, ¿por dónde íbamos? Oh sí, ya me acuerdo. Conseguiste el pesado libro conocido como El Megatomo.					
				Despertaste al espectro inmortal que aletargaba en la oscuridad debajo de Mingi Taw. Una pena, ¿no crees?			204	042.jpg	24B2J
				Son tiempos de angustia, una siniestra tormenta ha nublado el cielo y la gente encantadora que vive en la choza es desdichada.					
				Disipar la tormenta requerirá cierta familiaridad con psiónicos, criptozoología y milagros...					
			adventureUI/megatomeItem	1. El toque de un espadamante liberará El Megatomo, revelando los pensamientos no expresados de criaturas vivas y otros materiales esotéricos.					
			gourd/gourd	2. Extrañas hadas silvanas, generadoras de Espadamancia, dormitan en estanques, bosques y prados. Busca sus sutiles melodiosas brumas.					
			triangle/Triangle	3. El espadamante que pueda localizar, invocar y domar la geometría cósmica del Trigón Dorado poseerá la habilidad de obrar milagros.					
				¿Abrumado? Excelente. Mantén la calma y continúa.			210	043.jpg	A4C31
ARCHETYPE_GOLDMASTEROUTRO	The Archetype		triangle/Triangle	¡Bravo! Has localizado y sometido la geometría cósmica del Trigón Dorado.			86	044.jpg	24E4H
				Milagrosamente, la siniestra tormenta se ha disipado y la gloriosa luz del sol ha vuelto al reino, lo que es grandioso.					
				Tus heroicas hazañas reflejan bien tu percepción, intuición y perseverancia, ¡Lo has hecho muy bien hasta ahora!					
				Nota: Si decides continuar con el experimento S:S&S EP, las cualidades antes mencionadas serán desafiadas y puestas a prueba.					
				En cualquier caso, vamos a tomarnos otro pequeño descanso, ¿no crees?. Como siempre, estaré justo aquí cuando quieras comenzar con la Sesión III.					
ARCHETYPE_TRIFECTAINTRO	The Archetype								
				Comencemos con la Sesión III. Nota: Esta sesión requiere normalmente de un mes lunar para ser completada.					
			triangle/Triangle	¿Así que domaste el Trigón Dorado y la tormenta se disipó milagrosamente? Bravo por eso.					
			adventureUI/megatomeItem	Consulta El Megatomo y estudia su funcionamiento si te llegas a sentir perdido o confundido.					
				Un espectro inmortal aún acecha en la oscuridad debajo de Mingi Taw.					
			Archetype/trifecta	Considera la geometría cósmica de la Trifecta Trigónica.					
			MoonCrescent/moonCrescent	Observa el temperamento de la luna.			118	045.jpg	Y4E5Q
				Nuestra investigación ha demostrado que aquellos pocos que persisten a través de la locura oblicua que sigue pueden convertirse en amigos cósmicos para siempre.					
				Ten en cuenta que de ahora en adelante estaremos monitoreando todas tus acciones en relativo silencio.					
ARCHETYPE_TRIFECTAOUTRO	The Archetype		Archetype/trifecta	¿Así que domaste los dos Trigones restantes y reconstruiste la Trifecta Trigónica?			165	046.jpg	P4B6A
			Archetype/trifecta	Eres especial, y esa es exactamente la razón por la que me agradas tanto.					
				Fue muy valiente y generoso ofrecer como mártir a la Escita en la cima de Mingi Taw.					
				En serio, te debemos una.					
				Todo lo que resta es que arrastres a la Escita a la cima y seas testigo del Arremolinado Infinito.					
				Sé valiente, ¡El final está cerca!					
ARCHETYPE_GHOULINTRO	The Archetype								
				Bueno, aquí estamos. Esta sesión informativa finalizará el tratamiento S:S&S EP.					
				El funesto cometido de la Escita está cerca de completarse.					
				Por desgracia, el cuerpo y la psique de la Escita han sido significativamente socavados por la Espadamancia. Ahora se encuentra a las puertas de la muerte.			162	047.jpg	J4F7B
			Archetype/trifecta	Todo lo que resta es desvelar los secretos de el Bosque Trigónico y subir El Megatomo al Arremolinado Infinito en la cima de Mingi Taw.					
				Presiona iniciar solo si estás listo para ser testigo del terrible tormento del martirio.					
END	The Scythian			En la cima de Mingi Taw subimos El Megatomo a la seguridad eterna del Arremolinado Infinito.					
END_CHEAT	The Scythian			En la cima de Mingi Taw subimos El Megatomo a la seguridad eterna del Arremolinado Infinito. #cheat					
END_CHEAT_NOBOOR	The Scythian			En la cima de Mingi Taw subimos El Megatomo a la seguridad eterna del Arremolinado Infinito. #cheat #noboor					
END_CHEAT_PSYCHO	The Scythian			En la cima de Mingi Taw subimos El Megatomo a la seguridad eterna del Arremolinado Infinito. #cheat #psycho					
END_CHEAT_LOVE	The Scythian			En la cima de Mingi Taw subimos El Megatomo a la seguridad eterna del Arremolinado Infinito. #cheat #love			202	048.jpg	D4A81
END_MOONGROTTO_PSYCHO	The Scythian			En la cima de Mingi Taw subimos El Megatomo a la seguridad eterna del Arremolinado Infinito. #moongrotto #psycho			180	049.jpg	74D9P
END_MOONGROTTO_LOVE	The Scythian			En la cima de Mingi Taw subimos El Megatomo a la seguridad eterna del Arremolinado Infinito. #moongrotto #love			176	050.jpg	Y5F0P
END_HONEST_PSYCHO	The Scythian			En la cima de Mingi Taw subimos El Megatomo a la seguridad eterna del Arremolinado Infinito. #honest #psycho			179	051.jpg	M5C1H
END_HONEST_LOVE	The Scythian			En la cima de Mingi Taw subimos El Megatomo a la seguridad eterna del Arremolinado Infinito. #honest #love			177	052.jpg	55E2B
END_HONEST_NOBOOR	The Scythian			En la cima de Mingi Taw subimos El Megatomo a la seguridad eterna del Arremolinado Infinito. #honest #noboor			178	053.jpg	75G3V
GIRL_GHOULTHOUGHTS	Girl			¿Sabrá la Escita que es posible detener a La Masa Gogolítica tocando su calavera con Espadamancia? Probablemente no.					
				Espero que la Escita sepa que se moverá mucho más rápido si presiona dos veces al final del camino. Si no estará en problemas.					
				¿Dónde estoy? ¿Qué ha pasado? Lo último que recuerdo es que soñaba caminar por el bosque cuando vi una extraña luz rosa.					
LOGFELLA_GHOULTHOUGHTS	Logfella			La Escita sigue hablando sobre su funesto cometido de abrir una entrada al Arremolinado Infinito en la cima de Mingi Taw.					
				Todo ha sido totalmente mental desde que la Escita apareció muchas lunas atrás.					
LOGFELLA_GHOUL	The Scythian			Nos despertamos aturdidos de un sueño súper profundo cerca del Bosque Trigónico con el leñador conocido como Don Tronco a nuestro lado.			88	054.jpg	J5D44
				Don Tronco habló sobre cómo Samae había desaparecido la noche anterior.					
				El leñador sabía que estábamos cerca del final y que debíamos volver a Mingi Taw para finalizar nuestro funesto cometido.					
LOGFELLA_TRIGONGROVETIPS	The Scythian			El leñador conocido como Don Tronco nunca antes había visto el Bosque Trigónico y se preguntaba de qué se trataba todo aquello.					
LOGFELLA_TRIFECTATIPS	The Scythian			El leñador conocido como Don Tronco se sentía muy triste por la ausencia de Samae.					
				"Le dijimos a Don Tronco que sabíamos dónde podría estar ella y pronto arreglaríamos las cosas. "					
				Él miró la plataforma cercana y nos agradeció de antemano por todo lo relacionado con el martirio.					
URSULA_AVATAR			Ursula/idleSEhandsonhip						
DOG_AVATAR			AdventureUI/dudeDogfellaIdle1						
AMPHITHEATRE_LEFT	The Scythian	AdventureUI/tweetIconInfo		Estos dos tipos declararon encontrarse entre los creadores de este estrafalario mundo.			159	055.jpg	A5G55
AMPHITHEATRE_RIGHT	The Scythian	AdventureUI/tweetIconInfo		Los dos chiflados declararon encontrarse entre los creadores de este estrafalario mundo.			159	055.jpg	A5G55
GOURD_MOUNTAINMEADOW	The Scythian	AdventureUI/tweetIconGourd	gourd/gourd	Despertamos a una hada silvana que dormitaba en la tierra fértil de un prado habitado por cuatro pares de ovejas insignificantes.			52	056.jpg	15B63
GOURD_CABIN	The Scythian	AdventureUI/tweetIconGourd	gourd/gourd	Cantamos la Canción de Espadamancia y despertamos a una hada silvana que dormitaba en las frescas aguas de un estanque profundo, ¡Qué raro!			50	057.jpg	G5F78
GOURD_UPSLOPEWOODSONE	The Scythian	AdventureUI/tweetIconGourd	gourd/gourd	Despertamos a una hada silvana que dormitaba en una pajarera de aspecto curioso hogar de tres pájaros cantores empapados por la lluvia.					
GOURD_UPSLOPEWOODSTWO	The Scythian	AdventureUI/tweetIconGourd	gourd/gourd	Despertamos a una hada silvana que dormitaba junto a un puente de troncos donde cuatro pares de árboles se elevan sobre un río.					
GOURD_UPSLOPEWOODSFOUR	The Scythian	AdventureUI/tweetIconGourd	gourd/gourd	Despertamos a una hada silvana que dormitaba entre dos arcoíris repugnantes al lado del Precipicio Peligroso.					
GOURD_WATERFALLS	The Scythian	AdventureUI/tweetIconGourd	gourd/gourd	La Luna Oscura reina y despertamos a una hada silvana que dormitaba rodeada por cinco cascadas.					
GOURD_MOUNTAINTOP	The Scythian	AdventureUI/tweetIconGourd	gourd/gourd	La Luna Oscura reina y despertamos a una hada silvana que dormitaba en un matorral en lo alto de un peñasco rocoso.					
GOURD_SECRET2_STONESHELTER	The Scythian	AdventureUI/tweetIconGourd	gourd/gourd	La Luna Brillante se cierne y despertamos a una hada silvana que dormitaba en una arboleda oculta donde se encontraba Jim Guthrie.			132	058.jpg	G5F8U
GOURD_MOUNTAINLAKESHORE	The Scythian	AdventureUI/tweetIconGourd	gourd/gourd	La Luna Brillante se cierne y despertamos a una hada silvana que dormitaba en unas aguas serenas donde una mamá pata estaba fuera de sí.					
GOURD_LAKESHOREBUNNYSTRAIGHTAWAY	The Scythian	AdventureUI/tweetIconGourd	gourd/gourd	La Luna Brillante se cierne y despertamos a una hada silvana que dormitaba donde el reflejo del lago era ligeramente incongruente.			127	059.jpg	65D98
GOURD_LAKESHORELAKE	The Scythian	AdventureUI/tweetIconGourd	gourd/gourd	La Luna Brillante se cierne y despertamos a una hada silvana que dormitaba en un lago plácido bajo una trifecta de búhos.					
GOURD_PINKCOLLECTED	The Scythian	AdventureUI/tweetIconGourd	Archetype/trifecta	Tenemos esa sensación peculiar de que, tal vez, estemos ante la temporada de milagros. #miracles					
GOURD_MOUNTAINSIDE	The Scythian	AdventureUI/tweetIconGourd	gourd/gourd	La Luna Oscura reina y despertamos a una hada silvana que dormitaba rodeada por tres pequeñas cascadas.					
GOURD_SECRET1_FOOTOFMOUNTAIN	The Scythian	AdventureUI/tweetIconGourd	gourd/gourd	La Luna Oscura reina y despertamos a una hada silvana que dormitaba rodeada por cuatro pequeños árboles en los bosques más oscuros.					
GOURD_BRISKLYWALKING	The Scythian	AdventureUI/tweetIconGourd	gourd/gourd	La Luna Oscura reina y despertamos a una hada silvana que dormitaba en un matorral al otro lado de un lago.					
GOURD_HUGETREE	The Scythian	AdventureUI/tweetIconGourd	gourd/gourd	La Luna Brillante se cierne y despertamos a una hada silvana que dormitaba en la raíz de un árbol titánico.					
GOURD_BLUECOLLECTED	The Scythian	AdventureUI/tweetIconGourd	Archetype/trifecta	Tenemos esa sensación peculiar de que, tal vez, estemos ante la temporada de milagros. ¿Dónde están mis milagros? #miracles			77	060.jpg	86D06
GCLUE_MOUNTAINMEADOW	Dogfella	AdventureUI/tweetIconGourd		Guau Guau Guau Guau Guau Guau. #barking			135	061.jpg	M6F1I
				Guau Guau Guau. #justbarking					
				A veces me canso de ladrar todo el tiempo, pero un perro tiene que hacer lo que se supone que un perro tiene que hacer.					
				Guau Sniff Guau. #mixingitup					
				Guau Guau Guau Guau Guau Guau.					
GCLUE_UPSLOPEWOODSONE	Girl	AdventureUI/tweetIconGourd		Hay algo extraño en cómo se comportó la Escita, casi como si estuviera siendo controlada por una fuerza invisible.					
				Me gustaría saber más sobre la historia épica de la Escita, apuesto a que entonces todo tendría sentido.					
GCLUE_UPSLOPEWOODSTWO	Logfella	AdventureUI/tweetIconGourd		Espero que la Escita esté invirtiendo todos sus esfuerzos en el tema de las hadas silvanas.					
				La tormenta ha estado afectando mi ánimo y me ha hecho desear que los videojuegos existieran... sea lo que sea que eso signifique.					
GCLUE_UPSLOPEWOODSFOUR	Girl	AdventureUI/tweetIconGourd		Todo ha sido totalmente mental desde que la Escita apareció.			3	062.jpg	36E2Z
GCLUE_YELLOWCOLLECTED	Girl	AdventureUI/tweetIconGourd		Todo esto de la tormenta me ha estado afectando el ánimo. ¡Ha sido todo taaan sombrío!.					
				La lluvia ha comenzado a cesar y el cielo parece estar brillando... ¿Será la temporada de milagros? Eso espero. Me encantan los milagros.					
				Vaya... ¿Qué? Las ovejas del prado se han asustado... ¿Me pregunto qué estará pasando? Podría ser... ¿El Trigón Dorado?					
GCLUE_MOUNTAINTOP	Dogfella	AdventureUI/tweetIconGourd		"Guau Guau Guau. "					
				A veces cuando las cosas están demasiado oscuras para mi, ingiero algo y veo incluso lo que no está ahí.					
				Guau Guau Guau Guau Guau.					
GCLUE_SECRET2_STONESHELTER	Logfella	AdventureUI/tweetIconGourd		Tengo esta canción en mi cabeza... una canción alegre y triste que me llena de un extraño y hermoso temor.					
GCLUE_MOUNTAINLAKESHORE	Dogfella	AdventureUI/tweetIconGourd		Sé que buscas evitar tu funesto cometido, pero debes saber esto: el tiempo es una fuerza y, sin duda, seguirá su curso.					
				Guau Guau Guau. Sniff.					
GCLUE_LAKESHOREBUNNYSTRAIGHTAWAY	Dogfella	AdventureUI/tweetIconGourd		También hay sustantivos desconocidos, aunque estos se aprenden fácilmente.					
				Hay dos tipos de incógnitas, las incógnitas conocidas y las incógnitas desconocidas.			32	063.jpg	L6E31
