id	user	icon	portrait	English	Japanese	Final Notes	pic	Filenames	Codes
				"Guau Guau Guau. "					
GCLUE_LAKESHORELAKE	Logfella	AdventureUI/tweetIconGourd		Mi leña guarda muchos secretos... secretos sobre las hadas silvanas e islas imposibles. Lamentablemente, no hablo leño.					
				En mi experiencia, hay momentos en que los búhos no son lo que parecen... y otros en los que son simples búhos.			126	064.jpg	86A47
GCLUE_PINKCOLLECTED	The Archetype	AdventureUI/tweetIconGourd		Tal vez hayas oído hablar sobre una isla imposible bajo La Luna Brillante, puede que... ¿lo hayas leído en internet?			134	065.jpg	H6A5I
				Hemos estado siguiendo silenciosamente tus acciones y nos gustaría señalar que cuanto más tiempo tardes en decidir, más pequeña será la celebración.					
				Parece que has progresado bastante en tu esfuerzo para localizar y domar al Trigón Luna Brillante, muy bien hecho.					
GCLUE_MOUNTAINSIDE	Girl	AdventureUI/tweetIconGourd		¿Son las hadas silvanas hijos de la Madre Tierra o son visitantes solitarios del Arremolinado Infinito?					
				Para ser honesta, las hadas silvanas me asustan bastante. Es decir... ¿Qué son? ¿De dónde vienen?					
GCLUE_SECRET1_FOOTOFMOUNTAIN	Dogfella	AdventureUI/tweetIconGourd		Cuando las hadas hayan sido enviados hacia el cielo y la temporada de milagros se acerque, debes buscar el árbol titánico.					
				Sé que sabes lo que sé y quiero que sepas que estás completamente en lo correcto.			109	066.jpg	F6D6H
				Guau Guau Guau Sniff Guau Guau Guau.					
GCLUE_BRISKLYWALKING	Dogfella	AdventureUI/tweetIconGourd		Solo el final de tu funesto cometido traerá la paz de vuelta a nuestras vidas.					
				Sólo la Trifecta Trigónica te permitirá comprender los secretos del Bosque Trigónico.					
				El Arremolinado Infinito en la cima de Mingi Taw te espera.					
				Guau Guau Guau.					
GCLUE_WATERFALLS	Girl			¿Alguna vez has notado que a veces las palabras simplemente suenan como ruido, pero otras veces el ruido produce el sonido más hermoso?			132	058.jpg	G5F8U
GCLUE_HUGETREE	Logfella	AdventureUI/tweetIconGourd		Hay un montón de dichos extraños aquí entre los montañeses del Cáucaso.					
				Aquí en el Cáucaso hay un dicho que dice que un bosque necesita un fuego tanto como el fuego necesita al árbol.					
YELLOWTRIGON_COLLECTED	The Scythian			Conseguimos el Trigón Dorado. Somos impresionantes.			85	067.jpg	36G7U
PINKTRIGON_COLLECTED	The Scythian			Contra todo pronóstico, conseguimos el Trigón Luna Brillante.			155	068.jpg	56F8U
BLUETRIGON_COLLECTED	The Scythian			A pesar de todas las adversidades, conseguimos el Trigón Luna Oscura.			112	069.jpg	T6G94
GCLUE_BLUECOLLECTED	Girl	AdventureUI/tweetIconGourd		Parece como si todas las hadas Luna Oscura hubieran sido enviadas hacia el cielo, así que de nuevo es la temporada de milagros. ¡Adoro los milagros!					
JIM_HINT1_OFF	The Scythian			En una arboleda oculta nos encontramos con un tipo misterioso y musical situado junto a un fuego crepitante.					
JIM_PINKDAWN	The Scythian			En una arboleda oculta encontramos a un tipo misterioso junto a un fuego crepitante. #jimguthrie					
JIM_BRIGHTMOON	The Scythian			Mientras que La Luna Brillante se cernía, nos encontramos con un tipo misterioso y musical junto a un fuego crepitante. Dijo responder al nombre de Jim Guthrie.			128	070.jpg	07G00
JIM_POSTSWORCERY	The Scythian			El tipo misterioso y musical conocido como Jim Guthrie había presenciado nuestra Espadamancia y parecía haberle gustado bastante.					
JIM_POSTGOURD	The Scythian			El tipo misterioso y musical conocido como Jim Guthrie dijo que estaba listo para tocar una pequeña canción si queríamos escucharla.					
				Jim nos invitó a sentarnos junto al fuego.					
JIM_POSTSONG	The Scythian			Jim Guthrie nos había enseñado que no se podían negar los pensamientos malvados y no se podía negar la mordida del dragón.					
			Archetype/trifecta	Él nos contó sobre un concierto de rock que tenía programado tocar al otro lado del lago dentro de quince días.					
JIM_LOGFELLATHOUGHTS	Logfella			La canción sonaba tan familiar... ¿Dónde la había escuchado antes? #1000songs					
				De repente tenía esa extraña canción metida en la cabeza. #andwegotolder					
LOGFELLA_JIMTHOUGHTS	Logfella			He tenido esa canción metida en la cabeza durante años... Sólo unas pocas notas que se repiten una y otra vez. Me pregunto donde la he escuchado.					
ARCHETYPE_OTHERSIDEOFLAKE	The Archetype			Cruzar de manera segura el umbral de la liminalidad es sencillo: busca los lugares familiares y el calor del hogar.					
				Si logras estabilizar tu lucidez, podrás co-crear con ella... en lugar de luchar, resistir y maldecirla.					
				Cuando estás lúcido en un sueño, te das cuenta de quién has imaginado que eres... pero identificarte con el sueño es ser hechizado.					
				Incluso en un sueño ya conocido, hay nuevos lugares para explorar y nuevas conexiones para considerar... si sigues creyendo.					
GIRL_MOONGROTTOCOMMENT	Girl			Me siento como si el cosmos acabara de dar un vuelco y ahora todo estuviera un poco... apagado.					
LOGFELLA_MOONGROTTOCOMMENT	Logfella			"Es un largo camino del 0 al 1, y si un extraterrestre dijera ""Hola"" sería en un código críptico en el estéreo. Espera... ¿Qué?"					
GIRL_HUGETREETHOUGHTS	Girl			Por supuesto, nunca le hablo a la gente sobre estos sueños de la diosa/árbol porque probablemente me llamarían hippie o algo parecido.					
				En mi lugar especial, visito un árbol hueco titánico... Es una diosa muerta desde hace mucho tiempo y que precede a la humanidad desde eternos eones.					
				En mi sueño hay un lugar especial al que siempre voy, un parlamento de árboles en el corazón del mundo.					
LOGFELLA_HUGETREETHOUGHTS	Logfella			Me encanta ver los mismos bosques con diferente clima y me encanta simplemente detenerme y escuchar... y pensar o no pensar según sea el caso.					
				No paso mucho tiempo caminando por mis sueños, pero cuando lo hago tiendo a volver a visitar mis lugares favoritos para ver lo que ha cambiado.					
MIRACLE1_MOUNTAINMEADOW	The Scythian			"Hemos realizado un milagro disipa-tormentas en un prado bañado por el sol al estilo de plegado del mago loco ""Al Jaffee""."					
MIRACLE1_YELLOWTRIGONCOLLECTED	The Scythian			Nos quedamos confundidos y desconcertados en un prado bañado por el sol con uno de esos dolores de cabeza realmente brutales.					
LOGFELLA_YELLOWTRIGONCOLLECTED	The Scythian			Nos despertamos aturdidos de un sueño súper profundo sin un recuerdo en firme sobre lo que había sucedido.					
			triangle/Triangle	"Recordamos el milagro en el prado y nuestro encuentro con el Trigón Dorado... "					
			triangle/Triangle	...¿Qué poderes nuevos nos habrían sido concedidos?					
			triangle/Triangle	Don Tronco estaba totalmente anonadado cuando le contamos cómo fue la batalla contra el Trigón Dorado.			81	071.jpg	R7C14
			triangle/Triangle	Don Tronco se preguntó de que modo el Trigón Dorado podría estar conectado con los misterios sombríos de más allá del portón de hierro del prado..					
				Don Tronco no quiso excavar más en misterios sombríos y decidió volver a casa y empezar a cortar madera. #woodchopping					
LOGFELLA_BEFOREYELLOWBEAM	The Scythian			El leñador conocido como Don Tronco estaba súper encantado de que la tormenta se hubiera disipado y estaba emocionado de volver a cortar leña de nuevo.					
				Nos preguntó si sabíamos algo sobre el portón de hierro del prado que bloqueaba la cavernosa cueva... ¿De qué se trataría?					
LOGFELLA_YELLOWTRIGONTHOUGHTS	Logfella			Extraño... Veo un haz celeste dorado en el bosque detrás del prado... ¿Alguien ha descubierto los secretos del Bosque Trigónico?			89	072.jpg	67F24
LOGFELLA_URSULAMEADOW	Logfella			Estoy muy preocupado por la Escita, parece hecha un desastre.					
SCYTHIAN_YELLOWTRIGONCOLLECTED_OFF	The Scythian			El leñador y su hija contemplaron cómo recobrábamos el sentido.					
				Nos dimos cuenta que el prado no había cambiado, y que toda evidencia de nuestro encuentro místico había desaparecido.					
GIRL_YELLOWTRIGONCOLLECTED	The Scythian			Samae escuchó en silencio nuestra extraña historia sobre nuestro encuentro con el Trigón Dorado.					
			triangle/Triangle	Ella se preguntaba cuáles eran los secretos del Bosque Trigónico más allá de la cavernosa cueva del prado... ¿Habría alguna conexión?					
GIRL_YELLOWTRIGONTHOUGHTS	Girl			Hmm... Estoy bastante preocupada por la Escita... desapareció hace varios días después de que la tormenta se disipó. Espero que esté bien.					
GIRL_URSULAMEADOW_OFF	Girl			Vaya, ¿Entonces estaba la Escita desmayada en el prado? Qué locura.					
DOGFELLA_GETDARKTRIGON	The Scythian			Tras activar otro haz celeste en el Bosque Trigónico notamos algo peculiar en el perro conocido como Perronco.					
			Archetype/trifecta	De repente parecía que entendíamos a Perronco, nos instó a buscar el Trigón Luna Oscura y completar la Trifecta Trigónica.					
DOGFELLA_GETBRIGHTTRIGON	The Scythian			Tras activar otro haz celeste en el Bosque Trigónico notamos algo peculiar en el perro conocido como Perronco.					
			Archetype/trifecta	De repente parecía que entendíamos a Perronco, nos instó a buscar el Trigón Luna Brillante y completar la Trifecta Trigónica.					
DOGFELLA_THREETRIGONS	The Scythian			Tras activar otro haz celeste en el Bosque Trigónico notamos algo peculiar en el perro conocido como Perronco.					
			Archetype/trifecta	De repente parecía que entendíamos a Perronco, nos instó a activar el tercer haz de luz y abrir la entrada al Arremolinado Infinito.					
DOGFELLA_TRUTHBOMB	Dogfella			Guau Guau Guau.					
				Guau Guau Sniff Guau.					
				El Arremolinado Infinito del cosmos en la cima de Mingi Taw espera a aquel que carga con El Megatomo.					
				Guau Guau Guau Guau Guau.					
				Guau Guau Guau.					
GIRL_AFTERYELLOWBEAM	The Scythian			Samae estaba sentada en una roca junto al leñador que cortaba leña.					
			Archetype/trifecta	Le preguntamos a ella sobre los secretos del Bosque Trigónico y los sueños peculiares de los montañeses del Cáucaso.					
				Ella nos contó cómo los sueños de su gente contenían muchos misterios y cómo reflejaban el temperamento de la luna de maneras extrañas.					
				Samae nos invitó a sentarnos junto al fuego en la choza de piedra siempre que quisiéramos, ya fuera para caminar por los sueños o recobrar fuerzas.					
			Archetype/trifecta	Tenemos la sensación de que los dos Trigones restantes podrían estar perdidos en los sueños, o algo así.					
LOGFELLA_AFTERYELLOWBEAM	The Scythian			El leñador conocido como Don Tronco había vuelto a su corte de leña y parecía estar realmente concentrado.					
			triangle/Triangle	Don Tronco había visto el haz celeste en el bosque detrás del prado, así que le preguntamos sobre los secretos del Bosque Trigónico.					
				Nos contó una vieja historia que su gente relataba habitualmente a sus hijos para asustarlos.					
			Archetype/trifecta	Don Tronco habló de un pelotón de Escitas que llegó hace muchas lunas a estas montañas olvidadas buscando la Trifecta Trigónica.					
			gourd/gourd	"""El pelotón había aprendido a buscar hadas silvanas y enviarlas hacia el cielo... y luego buscaron un lugar para llevar a cabo un milagro."""					
			Archetype/trifecta	"""El pelotón esperaba activar los tres haces celestes en el Bosque Trigónico, pero no tenían idea de cuándo ni dónde estaban los Trigones."""					
				"""El pelotón deambuló sin rumbo durante mucho tiempo por el camino antiguo a Mingi Taw... eventualmente se cansaron y decidieron detenerse."""					
				"""Entonces el pelotón fue fulminado por un espectro inmortal al costado del camino antiguo, donde todavía quedan un puñado de tumbas en la actualidad."""					
				Le dijimos a Don Tronco que era una buena historia, pero en realidad no nos asustó tanto.					
GIRL_GRAVESCOMPLETETHOUGHTS	Girl								
ARCHETYPE_MOONGROTTO	The Archetype			Veo que has podido alterar el temperamento de la luna en la Gruta Lunar. Me pregunto cuánto durará esta paradoja temporal.					
MIRACLE2_ISLAND	The Scythian			Mientras La Luna Brillante se cernía, hemos realizado un extraño milagro lunar en una isla imposible en medio de un lago plácido.			136	073.jpg	W7A3K
MIRACLE2_PINKTRIGONCOLLECTED	The Scythian			Conseguimos el Trigón Luna Brillante para nuestra gloria y desesperación. #trigontamed			155	068.jpg	56F8U
MIRACLE2_BRIGHTMOONTRIGONCOLLECTED	The Scythian			Estuvimos tentados de abandonar todo el tema del funesto cometido, pero había algo atractivo en el martirio.					
				Aunque probablemente no importará demasiado al final. No es como que se tenga que superar un examen físico para acceder al Arremolinado Infinito.					
				Nos daba la sensación que todo esto de caminar en los sueños y domar Trigones estaba pasando factura en nuestra salud física.					
				Cuando las luces y los sonidos se calmaron, nos encontramos a orillas de un lago con un dolor de cabeza brutal y una nariz ensangrentada.					
GIRL_BRIGHTMOONTRIGONCOLLECTED	The Scythian		Archetype/trifecta	Hablamos con Samae sobre nuestro encuentro en sueños con el Trigón Luna Brillante y nuestra intención de reconstruir la Trifecta Trigónica.					
				Samae dijo que nuestro encuentro en sueños parecía realmente impresionante y que le hubiera encantado haber estado allí. #lies					
				Samae nos preguntó si habíamos visitado el Bosque Trigónico... ¿Tal vez podríamos activar otro haz celeste?					
LOGFELLA_BRIGHTMOONTRIGONCOLLECTED	The Scythian			El leñador pudo ver que nuestro caminar en sueños y realizar milagros había pasado factura en nuestra salud física.					
				Don Tronco parecía sospechar que nuestro funesto cometido muy probablemente no tendría un final feliz.					
				Don Tronco nos recordó que podíamos sentarnos junto al fuego de la choza y descansar de vez en cuando para recobrar fuerzas.					
ARCHETYPE_BRIGHTMOONTRIGONCOLLECTED	The Archetype			Nuestros datos de investigación muestran una alta correlación entre el progreso de un participante en S:S&S EP y su aptitud para ser impresionante.			45	074.jpg	87A43
				Veo que has conseguido localizar y recuperar el Trigón Luna Brillante. Una gran noticia, sin duda.					
MIRACLE3_HUGETREE	The Scythian			Mientras reinaba La Luna Oscura, hemos realizado un asombroso milagro en medio de un parlamento de árboles.					
MIRACLE3_DARKMOONTRIGONCOLLECTED	The Scythian			Además... llevar El Megatomo de arriba a abajo todo el tiempo era insufrible, realmente es un libro muy pesado en más de un sentido.					
				Nos sentíamos un poco peor por el desgaste... probablemente se debiera a todos esos haces de láser cósmico.					
				Cuando las luces y los sonidos cesaron, nos encontramos empapados por la fría lluvia en medio de un parlamento de árboles.					
GIRL_DARKMOONTRIGONCOLLECTED	The Scythian		Archetype/trifecta	Hablamos con Samae sobre nuestro encuentro en sueños con el Trigón Luna Oscura y nuestra intención de reconstruir la Trifecta Trigónica.					
				Le contamos cómo acabamos con el ataque arcoíris del Trigón Luna Oscura y a ella le pareció realmente impresionante.					
				A ella no parecía importarle escuchar nuestras locas historias.					
LOGFELLA_DARKMOONTRIGONCOLLECTED	The Scythian			El leñador pudo ver que nuestro caminar en sueños y realizar milagros había pasado factura en nuestra salud física.					
			Archetype/trifecta	Don Tronco nos preguntó si habíamos visitado con Perronco el Bosque Trigónico... ¿Tal vez podríamos activar otro haz celeste?					
ARCHETYPE_DARKMOONTRIGONCOLLECTED	The Archetype			Así que ahora la pregunta es... ¿Y ahora qué?					
				A pesar de la escasa información útil que te hemos proporcionado, has logrado dominar al Trigón Luna Oscura.					
				Me acaban de informar que has conseguido el Trigón Luna Oscura. Grandes noticias, sin duda.					
LOGFELLA_FOUNDBOORKEY	The Scythian		AdventureUI/keyItem	El leñador no reconoció la llave que habíamos encontrado y no tenía ni idea para qué servía.					
			AdventureUI/keyItem	¿...?					
GIRL_FOUNDBOORKEY	The Scythian		AdventureUI/keyItem	Samae vio la llave que habíamos encontrado y nos animó a mantener los ojos abiertos ante las puertas cerradas.					
				No tenía ninguna otra idea, pero nos recordó algo que habíamos visto en el camino antiguo a Mingi Taw.					
ARCHETYPE_GROTTOPARADOX	The Archetype								
				El temperamento de la luna ha sido alterado en la Gruta Lunar					
ARCHETYPE_KILLBOOR	The Archetype			Imagino que ahora te estarás preguntando para qué es esa llave. Para ser honesto, no tengo ni idea.			119	075.jpg	87C5S
				No es que esté sugiriendo que seas un sociópata violento... jeje... Estoy seguro que tenías tus buenas razones, ¿Verdad? #thegrizzledboor					
				Debería mencionar que el Tosco Pardo fue incluido en S:S&S EP para tentar a los participantes e identificar si eran unos sociópatas violentos.					
				Me acaban de informar que el Tosco Pardo ha sido asesinado... ¿Sabes algo de esto? #slaughter					
ARCHETYPE_SPAREBOOR	The Archetype			Imagino que ahora te estarás preguntando para qué es esa llave. Para ser honesto, no tengo ni idea.			119	075.jpg	87C5S
				Así que sí, eres impresionante y te queremos por ello.					
				El Tosco Pardo fue incluido en S:S&S EP para permitir a los participantes identificarse como personas compasivas y razonables.					
				Me acaban de informar que el Tosco Pardo ha podido escapar ileso. Es una noticia alentadora.					
LOGFELLA_FOUNDATION	Logfella			...					
				...					
				...					
SCYTHIAN_FOUNDATION	The Scythian			Despertamos a una hada silvana que dormitaba en un estanque profundo, al lado de una choza de piedra. Todo esto nos sorprende.					
				Con una tormenta sobre nuestras cabezas, hemos aprendido a cantar la Canción de Espadamancia para despertar a una dormitante hada silvana.					
				Espera... ¿Por qué me estoy refiriendo a mí misma en primera persona? Pensaba que nuestra historia la íbamos a contar en segunda persona. #editingoversight					
				¿Están mis pensamientos en el orden cronológico en que los he pensado? ¿Así que esto es lo que estaba pensando hace unos segundos?					
				¿Es este El Megatomo? ¿Absorbe transmisiones de pensamiento lingüístico? ¿Estoy leyendo mis pensamientos mientras los estoy pensando? Hmm...					
GIRL_FOUNDATION	Girl			...					
				...					
				...					
DOGFELLA_FOUNDATION	Dogfella			...					
				...					
				...					
LOGFELLA_DARKMOON	The Scythian			El leñador habló de caminar en sueños por el bosque en la hora antes del amanecer bajo un cielo oscuro y lleno de tormenta.					
				Él habló de una vibrante luz rosa y de una misteriosa canción emanando del bosque sin nombre detrás del prado.					
				Supusimos que Don Tronco probablemente hablaba del concierto de rock de La Luna Oscura.					
GIRL_DARKMOON	The Scythian			Samae habló habló de caminar en sueños por el bosque en la hora antes del amanecer bajo un cielo oscuro y lleno de tormenta.					
				Ella habló de cómo se había refugiado de la tormenta en un árbol hueco titánico.					
				Sabíamos de qué árbol hueco titánico estaba ella hablando.					
ARCHETYPE_DARKMOON	The Archetype			Ten cuidado. La Luna Oscura reina.			94	076.jpg	I7F69
LOGFELLA_CRESCENTWAX	The Scythian			El leñador habló habló de caminar en sueños por el bosque en la hora antes del amanecer, bajo una luna creciente.					
				Él habló sobre una criatura que había conocido, algo o alguien extraño y desnudo. ¿Era un oso? ¿Un hombre? o... ¿El Tosco Pardo?			57	077.jpg	I7G7U
GIRL_CRESCENTWAX	The Scythian			Samae estaba emocionada, ¡Hoy comenzaba un nuevo mes lunar! Le esperaban largos días sentada sobre rocas.					
ARCHETYPE_CRESCENTWAX	The Archetype			La brizna de una luna creciente ha aparecido, marcando el comienzo de un nuevo ciclo lunar de veintiocho días.			118	045.jpg	Y4E5Q
LOGFELLA_HALFWAX	The Scythian			El leñador admitió que sí, que de hecho había cortado una cantidad decente de leña a tiempo.					
				El habló de fríos inviernos y profundas nevadas aquí, en las majestuosas montañas del Cáucaso, aquellas que se elevaban por encima de las estepas de Escitia.					
				El leñador esperaba tener suficiente comida y leña para sobrevivir los largos y fríos meses que estaban por llegar.					
GIRL_HALFWAX	The Scythian			En mi sueño de anoche estaba caminando en el bosque y tenía mucho antojo de un muffin, pero no había ni un solo muffin.			108	078.jpg	07D87
ARCHETYPE_HALFWAX	The Archetype			Los folcloristas majaderos han afirmado que no hay relación causal entre la locura y el temperamento de la luna.					
LOGFELLA_ALMOSTWAX	The Scythian			El leñador dijo que nunca solía pensar demasiado en la Masa Gogolítica y en la montaña desierta de Mingi Taw.					
				Sin embargo, él dijo que últimamente la presencia espectral de la Masa Gogolítica había comenzado a acosarlo.					
				El leñador admitió que se le ponía la piel de gallina cuando La Luna Brillante se cernía... y cuando La Luna Oscura reinaba.					
GIRL_ALMOSTWAX	The Scythian			La chica comentó algo sobre la luna creciente... Se preguntó cuánto tiempo tardaría hasta que La Luna Brillante se cerniera en el cielo.					
ARCHETYPE_ALMOSTWAX	The Archetype			La luna crece ligeramente con cada día que pasa... en pocos días se convertirá en La Luna Brillante... ¿Y qué?			165	046.jpg	P4B6A
LOGFELLA_BRIGHTMOON	The Scythian			El leñador admitió que su perro se comportaba un poco extraño cada vez que La Luna Brillante se cernía del cielo.			135	061.jpg	M6F1I
GIRL_BRIGHTMOON	The Scythian			Samae habló habló de caminar en sueños por el bosque en la hora antes del amanecer, con La Luna Brillante cerniéndose en el cielo.					
				Ella habló del aire fresco de la mañana y de una isla imposible en medio de un lago plácido.					
ARCHETYPE_BRIGHTMOON	The Archetype			Sal afuera y mira hacia arriba, ¡Maravíllate con La Luna Brillante que se cierne en el cielo!			95	079.jpg	07D95
LOGFELLA_ALMOSTWANE	The Scythian			El leñador tenía muy baja tolerancia al folclore y admitió que por lo general le provocaba sueño. Sin embargo, él era bastante conocedor.					
				El leñador sabía todo sobre Mingi Taw y por qué era conocido como El Reino de las Nubes.					
				Él sabía que Mingi Taw era la montaña más alta del mundo conocido, más alta incluso que el Monte Olimpo, donde habitaban los dioses Aqueos.					
				Él también sabía que la cima de Mingi Taw, siempre envuelta en nubes, era considerada la entrada al Arremolinado Infinito.					
				El leñador nunca se había atrevido a pisar las temibles laderas de Mingi Taw, y nunca lo haría.					
GIRL_ALMOSTWANE	The Scythian			Samae se preguntó por qué tantos hongos crecían inmediatamente antes y después de La Luna Brillante... ¿A que se debería?					
ARCHETYPE_ALMOSTWANE	The Archetype			La luna está ligeramente menos brillante de lo que estaba ayer, el ciclo lunar está empezando a disminuir.					
LOGFELLA_HALFWANE	The Scythian			El leñador tenía muy baja tolerancia al folclore y admitió que por lo general le provocaba sueño. Sin embargo, él era bastante conocedor.					
				El leñador explicó que en Escitia y Persia Mingi Taw era conocido como La Montaña Eterna.					
				El leñador habló de cómo hace siglos una olvidada raza había tallado un templo en la roca debajo de Mingi Taw.					
				El leñador habló de los corredores subterráneos y los espacios cavernosos excavados en la roca debajo de Mingi Taw.					
				Según el leñador, esos espacios cavernosos fueron creados hace siglos para custodiar El Megatomo.					
GIRL_HALFWANE	The Scythian			Samae dijo haber caminado más allá de la muralla de piedra y haber sentido la terrible presencia de la Masa Gogolítica.			30	080.jpg	V8B04
ARCHETYPE_HALFWANE	The Archetype			El ciclo lunar está disminuyendo y La Luna Oscura está a poco menos de una semana de distancia.					
LOGFELLA_CRESCENTWANE	The Scythian			El leñador tenía muy baja tolerancia al folclore y admitió que por lo general le provocaba sueño. Sin embargo, él era bastante conocedor.					
				El leñador conocía a la Masa Gogolítica, el espectro inmortal que acechaba en la oscuridad debajo de Mingi Taw.					
				Don Tronco habló del Arremolinado Infinito, más allá de nuestra comprensión, del que surgió El Megatomo en la apenas recordada Edad de Piedra.					
				Él habló de una raza de seres inmortales del espacio que provocó en la humanidad una forma rudimentaria de pensamiento y transmisión lingüística.					
				"""Estos inmortales bendicieron a la humanidad con la capacidad de ser una civilización y así los condenaron a una eventual e inevitable extinción."""					
				"""Los escitas intentaron detener el insidioso crecimiento de la civilización, y por eso aislaron El Megatomo con su protector inmortal."""					
				"""El inmortal ha permanecido en la oscuridad desde entonces, deteriorándose para convertirse en un espectro inmortal conocido como La Masa Gogolítica."""					
				El leñador probablemente habría seguido y seguido con la tontería si no lo hubiéramos interrumpido educadamente.					
GIRL_CRESCENTWANE	The Scythian			Samae observó la luna menguante. Dijo que pronto se iría y que La Luna Oscura reinaría.					
ARCHETYPE_CRESCENTWANE	The Archetype			El ciclo lunar está casi completo. La Luna Oscura está muy cerca.					
DARKMOONLOOMS_ARCHETYPE	The Archetype			La Luna Oscura reina, el final del ciclo lunar está muy cerca.					
